<?xml version="1.0" encoding="UTF-8"?>
<airplanes xmlns:xsi="http://www.w3.org/2001/XMLSchema-instance" 
    xmlns="http://www.example.org/airplanes" xsi:schemaLocation="http://www.example.org/airplanes airplanes.xsd">
    <airplane id="1">
        <model>AC-130H Spectre 4</model>
        <origin>USA</origin>
        <chars>
            <type>SUPPORT</type>
            <seats>2</seats>
            <ammunition>
                <gun caliber="250"/>
                <rocket>
                    <airToAir amount="15" range="2000"/>
                    <airToGrnd amount="8" height="11000"/>
                </rocket>
            </ammunition>
            <radar name="standart"/>
        </chars>
        <parameters length="29.8" width="40.4" height="11.7"/>
        <price>10999</price>
    </airplane>
    <airplane id="2">
        <model>SU-35S</model>
        <origin>Russia</origin>
        <chars>
            <type>ESCORT</type>
            <seats>1</seats>
            <ammunition>
                <gun caliber="300"/>
            </ammunition>
            <radar name="standart"/>
        </chars>
        <parameters length="21.9" width="14.75" height="5.9"/>
        <price>19999</price>
    </airplane>
    <airplane id="3">
        <model>SU-34</model>
        <origin>Russia</origin>
        <chars>
            <type>FIGHT</type>
            <seats>2</seats>
            <ammunition>
                <gun caliber="200"/>
                <rocket>
                    <airToAir amount="20" range="3000"/>
                    <airToGrnd amount="10" height="12000"/>
                </rocket>
            </ammunition>
            <radar name="standart"/>
        </chars>
        <parameters length="23.3" width="14.7" height="6.09"/>
        <price>13499</price>
    </airplane>
    <airplane id="4">
        <model>MIG-31</model>
        <origin>USSR</origin>
        <chars>
            <type>INTERCEPT</type>
            <seats>2</seats>
            <ammunition>
                <gun caliber="250"/>
            </ammunition>
        </chars>
        <parameters length="22.7" width="13.4" height="7.19"/>
        <price>9991</price>
    </airplane>
    <airplane id="5">
        <model>Lockheed U-2</model>
        <origin>USA</origin>
        <chars>
            <type>SCOUT</type>
            <seats>1</seats>
            <radar name="standart"/>
        </chars>
        <parameters length="19.2" width="24.38" height="4.9"/>
        <price>17444</price>
    </airplane>
</airplanes>